{
  "chart_groups": [],
  "measurements": [
    {
      "claim_id": "claim-workloads-extend-beyond-spec-inputs--d4e5f6a7b8c9",
      "comparator": "SPEC-provided inputs only",
      "evidence_id": "evidence-spec-plus-additional-inputs--c409e7a11b8f",
      "measure_name": "workload input count",
      "measurement_id": "measurement-workload-total-inputs--116000000001",
      "outcome": "workload breadth for FDO evaluation",
      "population": "SPEC CINT2000 benchmarks plus additional representative inputs",
      "source_id": "source-aestimo-a-feedback-directed-optimization-evaluation-tool--e1d344900b12",
      "uncertainty": "reported total; source date unavailable but source extraction marked usable",
      "unit": "inputs",
      "value": 116,
      "value_max": null
    },
    {
      "claim_id": "claim-workloads-extend-beyond-spec-inputs--d4e5f6a7b8c9",
      "comparator": "116 total inputs",
      "evidence_id": "evidence-spec-plus-additional-inputs--c409e7a11b8f",
      "measure_name": "SPEC-provided input count",
      "measurement_id": "measurement-spec-provided-inputs--032000000002",
      "outcome": "standard input coverage within workload",
      "population": "SPEC CINT2000 benchmark inputs within the study workload",
      "source_id": "source-aestimo-a-feedback-directed-optimization-evaluation-tool--e1d344900b12",
      "uncertainty": "reported count; source extraction marked usable",
      "unit": "inputs",
      "value": 32,
      "value_max": null
    },
    {
      "claim_id": "claim-aestimo-compares-workload-runtime-effects--c3d4e5f6a7b8",
      "comparator": "single execution",
      "evidence_id": "evidence-workload-five-run-evaluation--a61b93f0c42d",
      "measure_name": "runtime trial count per binary-input pair",
      "measurement_id": "measurement-runtime-evaluation-repetitions--005000000003",
      "outcome": "runtime measurement replication",
      "population": "each FDO binary on each workload input",
      "source_id": "source-aestimo-a-feedback-directed-optimization-evaluation-tool--e1d344900b12",
      "uncertainty": "paper still observes large trial-to-trial ranges in some figures",
      "unit": "runs",
      "value": 5,
      "value_max": null
    },
    {
      "claim_id": "claim-itanium-fdo-inlining-improves-average-performance--f6a7b8c9d0e1",
      "comparator": "static binary",
      "evidence_id": "evidence-itanium-inlining-gains--d7b3409e6a21",
      "measure_name": "FDO inlining average performance improvement",
      "measurement_id": "measurement-itanium-inlining-average-gain--006000000004",
      "outcome": "performance improvement over static binary",
      "population": "Itanium experiments",
      "source_id": "source-aestimo-a-feedback-directed-optimization-evaluation-tool--e1d344900b12",
      "uncertainty": "reported as about 6%; processor and compiler-context dependent",
      "unit": "percent",
      "value": 6,
      "value_max": null
    },
    {
      "claim_id": "claim-itanium-fdo-inlining-improves-average-performance--f6a7b8c9d0e1",
      "comparator": "static binary",
      "evidence_id": "evidence-itanium-inlining-gains--d7b3409e6a21",
      "measure_name": "best-case FDO inlining slower cases",
      "measurement_id": "measurement-itanium-inlining-slower-cases--006000000005",
      "outcome": "slower than static binary",
      "population": "116 Itanium best-case FDO inlining cases",
      "source_id": "source-aestimo-a-feedback-directed-optimization-evaluation-tool--e1d344900b12",
      "uncertainty": "reported count out of 116 cases",
      "unit": "cases",
      "value": 6,
      "value_max": null
    },
    {
      "claim_id": "claim-itanium-fdo-inlining-improves-average-performance--f6a7b8c9d0e1",
      "comparator": "6 slower-than-static cases",
      "evidence_id": "evidence-itanium-inlining-gains--d7b3409e6a21",
      "measure_name": "best-case FDO inlining evaluation cases",
      "measurement_id": "measurement-itanium-inlining-slower-denominator--116000000006",
      "outcome": "case denominator for slower-than-static count",
      "population": "Itanium best-case FDO inlining evaluation",
      "source_id": "source-aestimo-a-feedback-directed-optimization-evaluation-tool--e1d344900b12",
      "uncertainty": "reported denominator",
      "unit": "cases",
      "value": 116,
      "value_max": null
    },
    {
      "claim_id": "claim-itanium-fdo-inlining-improves-average-performance--f6a7b8c9d0e1",
      "comparator": "static binary",
      "evidence_id": "evidence-itanium-inlining-gains--d7b3409e6a21",
      "measure_name": "best-case FDO inlining large-gain cases",
      "measurement_id": "measurement-itanium-inlining-large-gain-cases--041000000007",
      "outcome": "more than 10% faster than static",
      "population": "Itanium best-case FDO inlining evaluation",
      "source_id": "source-aestimo-a-feedback-directed-optimization-evaluation-tool--e1d344900b12",
      "uncertainty": "reported count; threshold is more than 10%",
      "unit": "cases",
      "value": 41,
      "value_max": null
    },
    {
      "claim_id": "claim-itanium-fdo-inlining-improves-average-performance--f6a7b8c9d0e1",
      "comparator": "static binary",
      "evidence_id": "evidence-itanium-inlining-gains--d7b3409e6a21",
      "measure_name": "large-gain threshold",
      "measurement_id": "measurement-itanium-inlining-large-gain-threshold--010000000008",
      "outcome": "faster-than-static threshold",
      "population": "Itanium best-case FDO inlining evaluation",
      "source_id": "source-aestimo-a-feedback-directed-optimization-evaluation-tool--e1d344900b12",
      "uncertainty": "reported as more than 10%; row records threshold value",
      "unit": "percent",
      "value": 10,
      "value_max": null
    },
    {
      "claim_id": "claim-bzip2-performance-varies-by-training-input--b8c9d0e1f2a3",
      "comparator": "static binary",
      "evidence_id": "evidence-bzip2-training-performance-range--b4a75e0f3d18",
      "measure_name": "bzip2 performance gain from combined training",
      "measurement_id": "measurement-bzip2-combined-training-gain--008000000009",
      "outcome": "performance gain",
      "population": "bzip2 on Itanium",
      "source_id": "source-aestimo-a-feedback-directed-optimization-evaluation-tool--e1d344900b12",
      "uncertainty": "reported as about 8%; figures had large runtime ranges between trials",
      "unit": "percent",
      "value": 8,
      "value_max": null
    },
    {
      "claim_id": "claim-bzip2-performance-varies-by-training-input--b8c9d0e1f2a3",
      "comparator": "static binary",
      "evidence_id": "evidence-bzip2-training-performance-range--b4a75e0f3d18",
      "measure_name": "bzip2 performance gain from xml training",
      "measurement_id": "measurement-bzip2-xml-training-gain--00200000000a",
      "outcome": "performance gain",
      "population": "bzip2 on Itanium",
      "source_id": "source-aestimo-a-feedback-directed-optimization-evaluation-tool--e1d344900b12",
      "uncertainty": "reported as only 2%; figures had large runtime ranges between trials",
      "unit": "percent",
      "value": 2,
      "value_max": null
    },
    {
      "claim_id": "claim-bzip2-performance-varies-by-training-input--b8c9d0e1f2a3",
      "comparator": "static binary",
      "evidence_id": "evidence-bzip2-training-performance-range--b4a75e0f3d18",
      "measure_name": "bzip2 best-case FDO performance improvement range",
      "measurement_id": "measurement-bzip2-bestcase-gain-range--00400000000b",
      "outcome": "best-case FDO performance improvement",
      "population": "bzip2 on Itanium individual evaluation inputs",
      "source_id": "source-aestimo-a-feedback-directed-optimization-evaluation-tool--e1d344900b12",
      "uncertainty": "reported as minimum about 4% and maximum about 13%",
      "unit": "percent",
      "value": 4,
      "value_max": 13
    },
    {
      "claim_id": "claim-bzip2-inlining-logs-split-by-alignment--a7b8c9d0e1f2",
      "comparator": "high-cut and low-cut alignment groups",
      "evidence_id": "evidence-bzip2-inlining-metric-tables--0f6e2c99aa54",
      "measure_name": "bzip2 full-comparison callsite count",
      "measurement_id": "measurement-bzip2-full-comparison-callsites--14640000000c",
      "outcome": "inlining decision space size",
      "population": "bzip2 inlining logs on Itanium, full comparison",
      "source_id": "source-aestimo-a-feedback-directed-optimization-evaluation-tool--e1d344900b12",
      "uncertainty": "reported in Tables 2-4; markdown table extraction noted as noisy",
      "unit": "callsites",
      "value": 1464,
      "value_max": null
    },
    {
      "claim_id": "claim-bzip2-inlining-logs-split-by-alignment--a7b8c9d0e1f2",
      "comparator": "1464 full-comparison callsites",
      "evidence_id": "evidence-bzip2-inlining-metric-tables--0f6e2c99aa54",
      "measure_name": "bzip2 yes-consensus choice count",
      "measurement_id": "measurement-bzip2-yes-consensus-choices--00000000000d",
      "outcome": "universally inlined callsites",
      "population": "bzip2 inlining logs on Itanium, full comparison",
      "source_id": "source-aestimo-a-feedback-directed-optimization-evaluation-tool--e1d344900b12",
      "uncertainty": "reported as no choices with yes consensus",
      "unit": "choices",
      "value": 0,
      "value_max": null
    },
    {
      "claim_id": "claim-bzip2-inlining-logs-split-by-alignment--a7b8c9d0e1f2",
      "comparator": "yes-consensus choices",
      "evidence_id": "evidence-bzip2-inlining-metric-tables--0f6e2c99aa54",
      "measure_name": "bzip2 full-comparison FDO choices with no consensus",
      "measurement_id": "measurement-bzip2-full-no-consensus-choices--83500000000e",
      "outcome": "FDO choice disagreement",
      "population": "bzip2 inlining logs on Itanium, full comparison",
      "source_id": "source-aestimo-a-feedback-directed-optimization-evaluation-tool--e1d344900b12",